[
  {
    "checkId": "CHK-01",
    "scenarioIds": [
      "AS09",
      "AS10"
    ],
    "riskIds": [
      "R09",
      "R10"
    ],
    "coverage": {
      "Prevent": false,
      "Detect": true,
      "Respond": false,
      "Recover": false
    },
    "rationale": "CHK-01 provides Detect coverage at the DEFENSE stage.",
    "mappingConfidence": "high"
  },
  {
    "checkId": "CHK-02",
    "scenarioIds": [
      "AS02",
      "AS09"
    ],
    "riskIds": [
      "R02",
      "R09"
    ],
    "coverage": {
      "Prevent": true,
      "Detect": false,
      "Respond": false,
      "Recover": false
    },
    "rationale": "CHK-02 provides Prevent coverage at the MANAGEMENT stage.",
    "mappingConfidence": "high"
  },
  {
    "checkId": "CHK-03",
    "scenarioIds": [
      "AS09"
    ],
    "riskIds": [
      "R09"
    ],
    "coverage": {
      "Prevent": true,
      "Detect": false,
      "Respond": false,
      "Recover": false
    },
    "rationale": "CHK-03 provides Prevent coverage at the MANAGEMENT stage.",
    "mappingConfidence": "high"
  },
  {
    "checkId": "CHK-04",
    "scenarioIds": [
      "AS09"
    ],
    "riskIds": [
      "R09"
    ],
    "coverage": {
      "Prevent": true,
      "Detect": false,
      "Respond": false,
      "Recover": false
    },
    "rationale": "CHK-04 provides Prevent coverage at the MANAGEMENT stage.",
    "mappingConfidence": "high"
  },
  {
    "checkId": "CHK-05",
    "scenarioIds": [
      "AS09"
    ],
    "riskIds": [
      "R09"
    ],
    "coverage": {
      "Prevent": true,
      "Detect": false,
      "Respond": false,
      "Recover": false
    },
    "rationale": "CHK-05 provides Prevent coverage at the MANAGEMENT stage.",
    "mappingConfidence": "high"
  },
  {
    "checkId": "CHK-06",
    "scenarioIds": [
      "AS09"
    ],
    "riskIds": [
      "R09"
    ],
    "coverage": {
      "Prevent": true,
      "Detect": false,
      "Respond": false,
      "Recover": false
    },
    "rationale": "CHK-06 provides Prevent coverage at the MANAGEMENT stage.",
    "mappingConfidence": "high"
  },
  {
    "checkId": "CHK-07",
    "scenarioIds": [
      "AS02",
      "AS09"
    ],
    "riskIds": [
      "R02",
      "R09"
    ],
    "coverage": {
      "Prevent": true,
      "Detect": false,
      "Respond": false,
      "Recover": false
    },
    "rationale": "CHK-07 provides Prevent coverage at the MANAGEMENT stage.",
    "mappingConfidence": "high"
  },
  {
    "checkId": "CHK-08",
    "scenarioIds": [
      "AS03",
      "AS09"
    ],
    "riskIds": [
      "R03",
      "R09"
    ],
    "coverage": {
      "Prevent": true,
      "Detect": false,
      "Respond": false,
      "Recover": false
    },
    "rationale": "CHK-08 provides Prevent coverage at the MANAGEMENT stage.",
    "mappingConfidence": "high"
  },
  {
    "checkId": "CHK-09",
    "scenarioIds": [
      "AS03",
      "AS09"
    ],
    "riskIds": [
      "R03",
      "R09"
    ],
    "coverage": {
      "Prevent": true,
      "Detect": true,
      "Respond": false,
      "Recover": false
    },
    "rationale": "CHK-09 provides Prevent, Detect coverage at the MANAGEMENT stage.",
    "mappingConfidence": "high"
  },
  {
    "checkId": "CHK-10",
    "scenarioIds": [
      "AS01",
      "AS03"
    ],
    "riskIds": [
      "R01",
      "R03"
    ],
    "coverage": {
      "Prevent": true,
      "Detect": false,
      "Respond": false,
      "Recover": false
    },
    "rationale": "CHK-10 provides Prevent coverage at the IDENTITY stage.",
    "mappingConfidence": "high"
  },
  {
    "checkId": "CHK-11",
    "scenarioIds": [
      "AS01",
      "AS03"
    ],
    "riskIds": [
      "R01",
      "R03"
    ],
    "coverage": {
      "Prevent": true,
      "Detect": false,
      "Respond": false,
      "Recover": false
    },
    "rationale": "CHK-11 provides Prevent coverage at the IDENTITY stage.",
    "mappingConfidence": "high"
  },
  {
    "checkId": "CHK-12",
    "scenarioIds": [
      "AS01",
      "AS02"
    ],
    "riskIds": [
      "R01",
      "R02"
    ],
    "coverage": {
      "Prevent": true,
      "Detect": false,
      "Respond": false,
      "Recover": false
    },
    "rationale": "CHK-12 provides Prevent coverage at the IDENTITY stage.",
    "mappingConfidence": "high"
  },
  {
    "checkId": "CHK-13",
    "scenarioIds": [
      "AS01",
      "AS03"
    ],
    "riskIds": [
      "R01",
      "R03"
    ],
    "coverage": {
      "Prevent": true,
      "Detect": false,
      "Respond": true,
      "Recover": false
    },
    "rationale": "CHK-13 provides Prevent, Respond coverage at the IDENTITY stage.",
    "mappingConfidence": "high"
  },
  {
    "checkId": "CHK-14",
    "scenarioIds": [
      "AS01",
      "AS02"
    ],
    "riskIds": [
      "R01",
      "R02"
    ],
    "coverage": {
      "Prevent": true,
      "Detect": false,
      "Respond": false,
      "Recover": false
    },
    "rationale": "CHK-14 provides Prevent coverage at the IDENTITY stage.",
    "mappingConfidence": "high"
  },
  {
    "checkId": "CHK-15",
    "scenarioIds": [
      "AS01"
    ],
    "riskIds": [
      "R01"
    ],
    "coverage": {
      "Prevent": true,
      "Detect": false,
      "Respond": false,
      "Recover": false
    },
    "rationale": "CHK-15 provides Prevent coverage at the IDENTITY stage.",
    "mappingConfidence": "high"
  },
  {
    "checkId": "CHK-16",
    "scenarioIds": [
      "AS03",
      "AS09"
    ],
    "riskIds": [
      "R03",
      "R09"
    ],
    "coverage": {
      "Prevent": true,
      "Detect": false,
      "Respond": false,
      "Recover": false
    },
    "rationale": "CHK-16 provides Prevent coverage at the MANAGEMENT stage.",
    "mappingConfidence": "high"
  },
  {
    "checkId": "CHK-17",
    "scenarioIds": [
      "AS04"
    ],
    "riskIds": [
      "R04"
    ],
    "coverage": {
      "Prevent": true,
      "Detect": false,
      "Respond": false,
      "Recover": false
    },
    "rationale": "CHK-17 provides Prevent coverage at the MANAGEMENT stage.",
    "mappingConfidence": "high"
  },
  {
    "checkId": "CHK-18",
    "scenarioIds": [
      "AS04"
    ],
    "riskIds": [
      "R04"
    ],
    "coverage": {
      "Prevent": true,
      "Detect": false,
      "Respond": false,
      "Recover": false
    },
    "rationale": "CHK-18 provides Prevent coverage at the MANAGEMENT stage.",
    "mappingConfidence": "high"
  },
  {
    "checkId": "CHK-19",
    "scenarioIds": [
      "AS04"
    ],
    "riskIds": [
      "R04"
    ],
    "coverage": {
      "Prevent": true,
      "Detect": false,
      "Respond": false,
      "Recover": false
    },
    "rationale": "CHK-19 provides Prevent coverage at the MANAGEMENT stage.",
    "mappingConfidence": "high"
  },
  {
    "checkId": "CHK-20",
    "scenarioIds": [
      "AS03",
      "AS04"
    ],
    "riskIds": [
      "R03",
      "R04"
    ],
    "coverage": {
      "Prevent": true,
      "Detect": false,
      "Respond": false,
      "Recover": false
    },
    "rationale": "CHK-20 provides Prevent coverage at the MANAGEMENT stage.",
    "mappingConfidence": "high"
  },
  {
    "checkId": "CHK-21",
    "scenarioIds": [
      "AS04"
    ],
    "riskIds": [
      "R04"
    ],
    "coverage": {
      "Prevent": true,
      "Detect": false,
      "Respond": false,
      "Recover": false
    },
    "rationale": "CHK-21 provides Prevent coverage at the HOST stage.",
    "mappingConfidence": "high"
  },
  {
    "checkId": "CHK-22",
    "scenarioIds": [
      "AS05"
    ],
    "riskIds": [
      "R05"
    ],
    "coverage": {
      "Prevent": true,
      "Detect": false,
      "Respond": false,
      "Recover": false
    },
    "rationale": "CHK-22 provides Prevent coverage at the HOST stage.",
    "mappingConfidence": "high"
  },
  {
    "checkId": "CHK-23",
    "scenarioIds": [
      "AS05",
      "AS06"
    ],
    "riskIds": [
      "R05",
      "R06"
    ],
    "coverage": {
      "Prevent": true,
      "Detect": false,
      "Respond": false,
      "Recover": false
    },
    "rationale": "CHK-23 provides Prevent coverage at the HOST stage.",
    "mappingConfidence": "high"
  },
  {
    "checkId": "CHK-24",
    "scenarioIds": [
      "AS03",
      "AS06",
      "AS10"
    ],
    "riskIds": [
      "R03",
      "R06",
      "R10"
    ],
    "coverage": {
      "Prevent": true,
      "Detect": false,
      "Respond": false,
      "Recover": false
    },
    "rationale": "CHK-24 provides Prevent coverage at the HOST stage.",
    "mappingConfidence": "medium"
  },
  {
    "checkId": "CHK-25",
    "scenarioIds": [
      "AS01"
    ],
    "riskIds": [
      "R01"
    ],
    "coverage": {
      "Prevent": true,
      "Detect": false,
      "Respond": false,
      "Recover": false
    },
    "rationale": "CHK-25 provides Prevent coverage at the IDENTITY stage.",
    "mappingConfidence": "high"
  },
  {
    "checkId": "CHK-26",
    "scenarioIds": [
      "AS03",
      "AS06"
    ],
    "riskIds": [
      "R03",
      "R06"
    ],
    "coverage": {
      "Prevent": true,
      "Detect": false,
      "Respond": true,
      "Recover": false
    },
    "rationale": "CHK-26 provides Prevent, Respond coverage at the MANAGEMENT stage.",
    "mappingConfidence": "high"
  },
  {
    "checkId": "CHK-27",
    "scenarioIds": [
      "AS09"
    ],
    "riskIds": [
      "R09"
    ],
    "coverage": {
      "Prevent": true,
      "Detect": false,
      "Respond": false,
      "Recover": false
    },
    "rationale": "CHK-27 provides Prevent coverage at the HOST stage.",
    "mappingConfidence": "high"
  },
  {
    "checkId": "CHK-28",
    "scenarioIds": [
      "AS05",
      "AS06"
    ],
    "riskIds": [
      "R05",
      "R06"
    ],
    "coverage": {
      "Prevent": false,
      "Detect": false,
      "Respond": true,
      "Recover": false
    },
    "rationale": "CHK-28 provides Respond coverage at the HOST stage.",
    "mappingConfidence": "high"
  },
  {
    "checkId": "CHK-29",
    "scenarioIds": [
      "AS05",